{
  "protocol_id": "solidworks-dimension-executor-capabilities",
  "schema_version": "1.0",
  "registry_version": "0.2.0",
  "executor": "repository-csharp-execution-service",
  "executor_version": "0.0.0",
  "plan_protocol_id": "solidworks-dimension-plan",
  "plan_schema_version": "1.0",
  "solidworks_target": "2025 SP5",
  "solidworks_revision": "33.5.0",
  "promotion_policy": "No capability becomes supported without native creation, in-memory readback, save/close/read-only reopen, stable identity, attachment, position, and display evidence. Engineering-valid plans remain publishable as capability_blocked.",
  "live_evidence": {
    "summary_sha256": "4825740c33e194cac695c13b2f3458ac3c332b833616763cf17ba7ec88bc0ca9",
    "solidworks_revision": "33.5.0"
  },
  "capabilities": [
    { "id": "model_dimension_import", "status": "planned" },
    { "id": "display_dimension_iteration", "status": "planned" },
    { "id": "attachment_persistent_reference", "status": "planned" },
    { "id": "annotation_position", "status": "planned" },
    { "id": "annotation_text_bounds", "status": "unsupported" },
    { "id": "linear_dimension", "status": "planned" },
    { "id": "diameter_dimension", "status": "planned" },
    { "id": "radius_dimension", "status": "planned" },
    { "id": "angular_dimension", "status": "planned" },
    { "id": "hole_callout", "status": "planned" },
    { "id": "chamfer_dimension", "status": "planned" },
    { "id": "dimension_tolerance", "status": "planned" },
    { "id": "dimension_prefix_suffix", "status": "planned" },
    { "id": "save_reopen_stable_identity", "status": "planned" }
  ],
  "dimension_types": {
    "linear": { "status": "planned", "reason": "F4 native execution candidate exists; live create/readback/save/reopen evidence is not yet published.", "verification": "none", "evidence_sha256": null },
    "aligned": { "status": "planned", "reason": "F4 native creation transaction is not implemented.", "verification": "none", "evidence_sha256": null },
    "diameter": { "status": "planned", "reason": "F4 native execution candidate exists; live create/readback/save/reopen evidence is not yet published.", "verification": "none", "evidence_sha256": null },
    "radius": { "status": "planned", "reason": "F4 native execution candidate exists; live create/readback/save/reopen evidence is not yet published.", "verification": "none", "evidence_sha256": null },
    "angular": { "status": "planned", "reason": "F4 native execution candidate exists; live create/readback/save/reopen evidence is not yet published.", "verification": "none", "evidence_sha256": null },
    "reference": { "status": "planned", "reason": "F4 native execution candidate exists; live create/readback/save/reopen evidence is not yet published.", "verification": "none", "evidence_sha256": null },
    "hole_diameter": { "status": "planned", "reason": "F4 basic hole-callout execution candidate exists; live persisted evidence is not yet published.", "verification": "none", "evidence_sha256": null },
    "hole_depth": { "status": "planned", "reason": "F4 basic hole-callout execution candidate exists; live persisted evidence is not yet published.", "verification": "none", "evidence_sha256": null },
    "hole_quantity": { "status": "planned", "reason": "F4 basic hole-callout execution candidate exists; live persisted evidence is not yet published.", "verification": "none", "evidence_sha256": null },
    "hole_spacing": { "status": "planned", "reason": "F4 native creation transaction is not implemented.", "verification": "none", "evidence_sha256": null },
    "hole_group_location": { "status": "planned", "reason": "F4 native creation transaction is not implemented.", "verification": "none", "evidence_sha256": null },
    "overall": { "status": "planned", "reason": "F4 native creation transaction is not implemented.", "verification": "none", "evidence_sha256": null },
    "step": { "status": "planned", "reason": "F4 native creation transaction is not implemented.", "verification": "none", "evidence_sha256": null },
    "boss": { "status": "planned", "reason": "F4 native creation transaction is not implemented.", "verification": "none", "evidence_sha256": null },
    "slot": { "status": "planned", "reason": "F4 native creation transaction is not implemented.", "verification": "none", "evidence_sha256": null },
    "chamfer": { "status": "planned", "reason": "F5 advanced chamfer execution is not implemented.", "verification": "none", "evidence_sha256": null },
    "fillet": { "status": "planned", "reason": "F5 advanced fillet execution is not implemented.", "verification": "none", "evidence_sha256": null },
    "symmetric": { "status": "planned", "reason": "F4 native creation transaction is not implemented.", "verification": "none", "evidence_sha256": null }
  },
  "elements": {
    "model_dimension_import": { "status": "planned", "reason": "F4 imports and filters model dimensions in code; production live transaction evidence remains absent.", "verification": "none", "evidence_sha256": null },
    "attachment_persistent_reference": { "status": "planned", "reason": "F4 resolves and verifies frozen references in code; committed live readback evidence remains absent.", "verification": "none", "evidence_sha256": null },
    "annotation_position": { "status": "planned", "reason": "F4 writes and verifies frozen positions in code; committed live readback evidence remains absent.", "verification": "none", "evidence_sha256": null },
    "annotation_text_bounds": { "status": "unsupported", "reason": "SolidWorks 2025 SP5 does not expose exact glyph bounds for ordinary display dimensions.", "verification": "live", "evidence_sha256": "4825740c33e194cac695c13b2f3458ac3c332b833616763cf17ba7ec88bc0ca9" },
    "dimension_tolerance": { "status": "planned", "reason": "Trusted-source native tolerance write/readback remains an F4/F5 task.", "verification": "none", "evidence_sha256": null },
    "dimension_prefix_suffix": { "status": "planned", "reason": "F4 writes and verifies prefix/suffix in code; committed live readback evidence remains absent.", "verification": "none", "evidence_sha256": null },
    "save_reopen_stable_identity": { "status": "planned", "reason": "F4 implements save/close/read-only-reopen identity checks; live promotion evidence remains absent.", "verification": "none", "evidence_sha256": null }
  }
}
